{
  "schema_version": 1,
  "query": {
    "task_id": "T-999",
    "task_type": "bugfix",
    "any_task_type": false,
    "strict_validity": false
  },
  "pinned": {
    "bank_content_hash": "b8f64d5286a0038e28167c528b8f22e94850aa090c216466db70339847a20331",
    "grafos_index_id": "sha256:0bb29b7b105e2b89"
  },
  "results": {
    "successes": [
      {
        "experience_id": "EXP-184135407745244",
        "run_id": "RUN-20260723-4245610141",
        "harness_id": "harness-000001",
        "task_features_ref": "artifact://runs/artifacts/8113a5a67959bbac83fd9d3c682ea32af5a50e5b877f66fd8cf5617b4ebbbb8a.json",
        "outcome": { "success": true, "primary_reward": 1.0 },
        "context_present": true,
        "effective_validity": {
          "status": "suspect",
          "reasons": ["grafos_index_id moved since ingest (sha256:0bb29b7b105e2b89 -> live) while all referenced_symbols still resolve"]
        },
        "filters_passed": ["validity", "task_type=bugfix"]
      }
    ],
    "failures": []
  },
  "discarded": [
    {
      "experience_id": "EXP-100000000000001",
      "reason": "stale: referenced symbol no longer resolves",
      "effective_validity": {
        "status": "stale",
        "reasons": ["referenced symbol pkg.mod:gone_helper not resolvable in live index"]
      }
    },
    {
      "experience_id": "EXP-100000000000002",
      "reason": "task_type mismatch (increment_orchestration != bugfix)",
      "effective_validity": { "status": "current", "reasons": [] }
    }
  ]
}
